{
  "order_id": "ord_fixture_rescheduled",
  "campaign_id": "campaign_fixture_partner",
  "list_id": "list_fixture_42",
  "source": "propstream",
  "external_account_id": "tenant_fixture",
  "external_user_id": "user_fixture_42",
  "external_user_metadata": {
    "segment": "fixture"
  },
  "product_type": "4x6_printed",
  "previous_mail_date": "2026-07-20",
  "new_mail_date": "2026-07-27",
  "event_id": "44444444-4444-4444-8444-444444444444",
  "event_type": "order.rescheduled",
  "timestamp": "2026-07-14T15:00:00+00:00"
}
